motif_code,title,level_1_category,level_2_category,level_2_range,level_3_category,level_3_range
K1310,Seduction by disguise or substitution. Irish myth: Cross; Icelandic:,Deceptions,Seduction or deceptive marriage,K1300-K1399,Seduction or deceptive marriage.,K1300-K1399
K1330,Girl tricked into man's room (or power).,Deceptions,Seduction or deceptive marriage,K1300-K1399,Seduction or deceptive marriage.,K1300-K1399
K1340,Entrance into girl's (man's) room (bed) by trick.,Deceptions,Seduction or deceptive marriage,K1300-K1399,Seduction or deceptive marriage.,K1300-K1399
K1350,Woman persuaded (or wooed) by trick.,Deceptions,Seduction or deceptive marriage,K1300-K1399,Seduction or deceptive marriage.,K1300-K1399
K1380,Seductions—miscellaneous.,Deceptions,Seduction or deceptive marriage,K1300-K1399,Seduction or deceptive marriage.,K1300-K1399
K1400,Dupe's property destroyed. Type 1002.,Deceptions,Dupe's property destroyed,K1400-K1499,Dupe's property destroyed,K1400-K1499
K1410,Dupe's goods destroyed. West Indies: Flowers 539.,Deceptions,Dupe's property destroyed,K1400-K1499,Dupe's property destroyed,K1400-K1499
K1440,Dupe's animals destroyed or maimed. Type 1007; India: Thompson-,Deceptions,Dupe's property destroyed,K1400-K1499,Dupe's property destroyed,K1400-K1499
K1460,Members of dupe's family killed.,Deceptions,Dupe's property destroyed,K1400-K1499,Dupe's property destroyed,K1400-K1499
K1500,Deception connected with adultery.,Deceptions,Deceptions connected with adultery,K1500-K1599,Deceptions connected with adultery.,K1500-K1599
K1510,Adulteress outwits husband. *Penzer V 106 n. 1; *Bolte Frey 223f.,Deceptions,Deceptions connected with adultery,K1500-K1599,Deceptions connected with adultery.,K1500-K1599
K1550,Husband outwits adulteress and paramour. India: Thompson-Balys.,Deceptions,Deceptions connected with adultery,K1500-K1599,Deceptions connected with adultery.,K1500-K1599
K1570,Trickster outwits adulteress and paramour.,Deceptions,Deceptions connected with adultery,K1500-K1599,Deceptions connected with adultery.,K1500-K1599
K1580,Other deceits connected with adultery.,Deceptions,Deceptions connected with adultery,K1500-K1599,Deceptions connected with adultery.,K1500-K1599
K1600,Deceiver falls into own trap. Indonesia: DeVries's list Nos. 59-79;,Deceptions,Deceiver falls into own trap,K1600-K1699,Deceiver falls into own trap.,K1600-K1699
K1610,Deceiver falls into his own trap—miscellaneous incidents. India:,Deceptions,Deceiver falls into own trap,K1600-K1699,Deceiver falls into own trap.,K1600-K1699
K1700,Deception through bluffing.,Deceptions,DECEPTION THROUGH SHAMS,K1700-K2099,Deception through bluffing,K1700-K1799
K1710,Ogre (large animal) overawed. Missouri French: Carrière; Spanish:,Deceptions,DECEPTION THROUGH SHAMS,K1700-K2099,Deception through bluffing,K1700-K1799
K1760,Other bluffs.,Deceptions,DECEPTION THROUGH SHAMS,K1700-K2099,Deception through bluffing,K1700-K1799
K1800,Deception by disguise or illusion. Irish myth: *Cross.,Deceptions,DECEPTION THROUGH SHAMS,K1700-K2099,Deception by disguise or illusion.,K1800-K1899
K1810,Deception by disguise. Irish myth: *Cross.,Deceptions,DECEPTION THROUGH SHAMS,K1700-K2099,Deception by disguise or illusion.,K1800-K1899
K1840,Deception by substitution. Irish myth: Cross; India: Thompson-Balys.,Deceptions,DECEPTION THROUGH SHAMS,K1700-K2099,Deception by disguise or illusion.,K1800-K1899
K1860,Deception by feigned death (sleep). India: *Thompson-Balys.,Deceptions,DECEPTION THROUGH SHAMS,K1700-K2099,Deception by disguise or illusion.,K1800-K1899
K1870,Illusions. *BP III 201ff.; *Hibbard 205 n. 9; Irish myth: *Cross.,Deceptions,DECEPTION THROUGH SHAMS,K1700-K2099,Deception by disguise or illusion.,K1800-K1899
K1890,Other deceptions by disguise or illusion.,Deceptions,DECEPTION THROUGH SHAMS,K1700-K2099,Deception by disguise or illusion.,K1800-K1899
K1900,Impostures.,Deceptions,DECEPTION THROUGH SHAMS,K1700-K2099,Impostures,K1900-K1999
K1910,Marital impostors.,Deceptions,DECEPTION THROUGH SHAMS,K1700-K2099,Impostures,K1900-K1999
K1920,Substituted children.,Deceptions,DECEPTION THROUGH SHAMS,K1700-K2099,Impostures,K1900-K1999
K1930,Treacherous impostors.,Deceptions,DECEPTION THROUGH SHAMS,K1700-K2099,Impostures,K1900-K1999
K1950,Sham prowess.,Deceptions,DECEPTION THROUGH SHAMS,K1700-K2099,Impostures,K1900-K1999
K1970,Sham miracles.,Deceptions,DECEPTION THROUGH SHAMS,K1700-K2099,Impostures,K1900-K1999
K1980,Other impostures. K2165. Sham blind man throws suspicion on real,Deceptions,DECEPTION THROUGH SHAMS,K1700-K2099,Impostures,K1900-K1999
K2000,Hypocrites.,Deceptions,DECEPTION THROUGH SHAMS,K1700-K2099,Hypocrites,K2000-K2099
K2010,Hypocrite pretends friendship but attacks. Jewish: Neuman; India:,Deceptions,DECEPTION THROUGH SHAMS,K1700-K2099,Hypocrites,K2000-K2099
K2030,Double dealers.,Deceptions,DECEPTION THROUGH SHAMS,K1700-K2099,Hypocrites,K2000-K2099
K2050,Pretended virtue. K1912. The false virgin.,Deceptions,DECEPTION THROUGH SHAMS,K1700-K2099,Hypocrites,K2000-K2099
K2060,Detection of hypocrisy.,Deceptions,DECEPTION THROUGH SHAMS,K1700-K2099,Hypocrites,K2000-K2099
K2090,Other hypocritical acts.,Deceptions,DECEPTION THROUGH SHAMS,K1700-K2099,Hypocrites,K2000-K2099
K2100,False accusation. Missouri French: Carrière; Jewish: Neuman; India:,Deceptions,False accusations,K2100-K2199,False accusations,K2100-K2199
K2110,Slanders. Jewish: *Neuman.,Deceptions,False accusations,K2100-K2199,False accusations,K2100-K2199
K2130,Trouble-makers. Irish myth: *Cross.,Deceptions,False accusations,K2100-K2199,False accusations,K2100-K2199
K2150,Innocent made to appear guilty. B[ö]dker Exempler 303 No. 74;,Deceptions,False accusations,K2100-K2199,False accusations,K2100-K2199
K2200,Villains and traitors. Irish myth: Cross.,Deceptions,Villains and traitors,K2200-K2299,Villains and traitors,K2200-K2299
K2210,Treacherous relatives. Distinction between treacherous relatives and,Deceptions,Villains and traitors,K2200-K2299,Villains and traitors,K2200-K2299
K2220,Treacherous rivals. Irish myth: *Cross; Icelandic: Boberg; Missouri,Deceptions,Villains and traitors,K2200-K2299,Villains and traitors,K2200-K2299
K2230,Treacherous lovers. (Cf. K2221.),Deceptions,Villains and traitors,K2200-K2299,Villains and traitors,K2200-K2299
K2240,Treacherous officers and tradesmen.,Deceptions,Villains and traitors,K2200-K2299,Villains and traitors,K2200-K2299
K2250,"Treacherous servants and workmen. Types 450, 652; Dickson 236 n.",Deceptions,Villains and traitors,K2200-K2299,Villains and traitors,K2200-K2299
K2260,"Dark traitors. Persons darks by race, habitual occupation, or",Deceptions,Villains and traitors,K2200-K2299,Villains and traitors,K2200-K2299
K2270,Deformed villains.,Deceptions,Villains and traitors,K2200-K2299,Villains and traitors,K2200-K2299
K2280,Treacherous churchmen.,Deceptions,Villains and traitors,K2200-K2299,Villains and traitors,K2200-K2299
K2290,Other villains and traitors.,Deceptions,Villains and traitors,K2200-K2299,Villains and traitors,K2200-K2299
K2300,Other deceptions.,Deceptions,Other deceptions,K2300-K2399,Other deceptions,K2300-K2399
K2310,Deception by equivocation. Irish myth: *Cross; Missouri French:,Deceptions,Other deceptions,K2300-K2399,Other deceptions,K2300-K2399
K2320,Deception by frightening. Missouri French: Carrière; Spanish:,Deceptions,Other deceptions,K2300-K2399,Other deceptions,K2300-K2399
K2350,Military strategy.,Deceptions,Other deceptions,K2300-K2399,Other deceptions,K2300-K2399
K2370,Miscellaneous deceptions.,Deceptions,Other deceptions,K2300-K2399,Other deceptions,K2300-K2399
L0,"Victorious youngest child. *Fb ""yngst"" III 1132a; *Saintyves Perrault 128ff.;",Reversals of Fortune,Victorious youngest child,L0-L99,Victorious youngest child,L0-L99
L10,"Victorious youngest son. *Types 326, 402, 471, 513, 550, 551, 554, 569,",Reversals of Fortune,Victorious youngest child,L0-L99,Victorious youngest child,L0-L99
L50,"Victorious youngest daughter. *Types 361, 425, 431, 440, 480, 510, 511,",Reversals of Fortune,Victorious youngest child,L0-L99,Victorious youngest child,L0-L99
L70,Youngest of group victorious.,Reversals of Fortune,Victorious youngest child,L0-L99,Victorious youngest child,L0-L99
L100,Unpromising hero (heroine). Irish myth: *Cross; India: *Thompson-,Reversals of Fortune,Unpromising hero (heroine),L100-L199,Unpromising hero (heroine),L100-L199
L110,Types of unpromising heroes (heroines).,Reversals of Fortune,Unpromising hero (heroine),L100-L199,Unpromising hero (heroine),L100-L199
L130,Abode of unpromising hero (heroine).,Reversals of Fortune,Unpromising hero (heroine),L100-L199,Unpromising hero (heroine),L100-L199
L140,The unpromising surpasses the promising.,Reversals of Fortune,Unpromising hero (heroine),L100-L199,Unpromising hero (heroine),L100-L199
L160,"Success of the unpromising hero (heroine). Irish: *Cross, O'Suilleabhain",Reversals of Fortune,Unpromising hero (heroine),L100-L199,Unpromising hero (heroine),L100-L199
L200,Modesty brings reward.,Reversals of Fortune,Modesty brings reward,L200-L299,Modesty brings reward,L200-L299
L210,"Modest choice best. Types 480, 580. See also references to L211 and",Reversals of Fortune,Modesty brings reward,L200-L299,Modesty brings reward,L200-L299
L220,Modest request best. *Cox 480; *BP II 232; *MacCulloch Childhood,Reversals of Fortune,Modesty brings reward,L200-L299,Modesty brings reward,L200-L299
L250,Modest business plans best.,Reversals of Fortune,Modesty brings reward,L200-L299,Modesty brings reward,L200-L299
L290,Modesty brings reward—miscellaneous.,Reversals of Fortune,Modesty brings reward,L200-L299,Modesty brings reward,L200-L299
L300,Triumph of the weak. Chauvin II 204 No. 59; Irish myth: Cross.,Reversals of Fortune,Triumph of the weak,L300-L399,Triumph of the weak.,L300-L399
L310,Weak overcomes strong in conflict.,Reversals of Fortune,Triumph of the weak,L300-L399,Triumph of the weak.,L300-L399
L330,Easy escape of weak (small).,Reversals of Fortune,Triumph of the weak,L300-L399,Triumph of the weak.,L300-L399
L350,Mildness triumphs over violence.,Reversals of Fortune,Triumph of the weak,L300-L399,Triumph of the weak.,L300-L399
L390,Triumph of the weak-miscellaneous.,Reversals of Fortune,Triumph of the weak,L300-L399,Triumph of the weak.,L300-L399
L400,Pride brought low. Jewish: *Neuman.,Reversals of Fortune,Pride brought low,L400-L499,Pride brought low,L400-L499
L410,Proud ruler (deity) humbled.,Reversals of Fortune,Pride brought low,L400-L499,Pride brought low,L400-L499
L420,Overweening ambition punished. Chinese: Graham.,Reversals of Fortune,Pride brought low,L400-L499,Pride brought low,L400-L499
L430,Arrogance repaid. Icelandic *Boberg.,Reversals of Fortune,Pride brought low,L400-L499,Pride brought low,L400-L499
L450,Proud animal less fortunate than humble.,Reversals of Fortune,Pride brought low,L400-L499,Pride brought low,L400-L499
L460,Pride brought low—miscellaneous.,Reversals of Fortune,Pride brought low,L400-L499,Pride brought low,L400-L499
M0,Judgments and decrees.,Ordaining the Future,Judgments and decrees,M0-M99,Judgments and decrees,M0-M99
M10,Irrevocable judgments.,Ordaining the Future,Judgments and decrees,M0-M99,Judgments and decrees,M0-M99
M20,Short-sighted judgments.,Ordaining the Future,Judgments and decrees,M0-M99,Judgments and decrees,M0-M99
M50,Other judgments and decrees.,Ordaining the Future,Judgments and decrees,M0-M99,Judgments and decrees,M0-M99
M90,Judgments and decrees—miscellaneous motifs.,Ordaining the Future,Judgments and decrees,M0-M99,Judgments and decrees,M0-M99
M100,"Vows and oaths. *Penzer X 355 s.v. ""vow""; *Hdwb. d. Abergl. II 659ff.;",Ordaining the Future,Vows and oaths,M100-M199,Vows and oaths,M100-M199
M110,Taking of vows and oaths.,Ordaining the Future,Vows and oaths,M100-M199,Vows and oaths,M100-M199
M120,Vows concerning personal appearance.,Ordaining the Future,Vows and oaths,M100-M199,Vows and oaths,M100-M199
M130,"Vows concerning sex. (Cf. M151.2, M152.)",Ordaining the Future,Vows and oaths,M100-M199,Vows and oaths,M100-M199
M150,Other vows and oaths.,Ordaining the Future,Vows and oaths,M100-M199,Vows and oaths,M100-M199
M200,Bargains and promises. India: Thompson-Balys.,Ordaining the Future,Bargains and promises,M200-M299,Bargains and promises,M200-M299
M210,"Bargain with devil. Types 310, 313A, 316, 360, 400, 425C, 441, 500,",Ordaining the Future,Bargains and promises,M200-M299,Bargains and promises,M200-M299
M220,Other bargains.,Ordaining the Future,Bargains and promises,M200-M299,Bargains and promises,M200-M299
M250,Promises connected with death.,Ordaining the Future,Bargains and promises,M200-M299,Bargains and promises,M200-M299
M260,Other promises.,Ordaining the Future,Bargains and promises,M200-M299,Bargains and promises,M200-M299
M290,Bargains and promises—miscellaneous.,Ordaining the Future,Bargains and promises,M200-M299,Bargains and promises,M200-M299
M300,"Prophecies. *Encyc. Rel. Ethics s.v. ""Divination""; Irish: *Cross, Beal",Ordaining the Future,Prophecies,M300-M399,Prophecies,M300-M399
M310,Favorable prophecies. Irish myth: *Cross.,Ordaining the Future,Prophecies,M300-M399,Prophecies,M300-M399
M340,Unfavorable prophecies.,Ordaining the Future,Prophecies,M300-M399,Prophecies,M300-M399
M360,Other prophecies.,Ordaining the Future,Prophecies,M300-M399,Prophecies,M300-M399
M370,"Vain attempts to escape fulfillment of prophecy. (Cf. M341.2.10,",Ordaining the Future,Prophecies,M300-M399,Prophecies,M300-M399
M390,Prophecies—miscellaneous motifs. Irish myth: Cross.,Ordaining the Future,Prophecies,M300-M399,Prophecies,M300-M399
M400,"Curses. *Encyc. Rel. Ethics s.v. ""Cursing and Blessing""; Icelandic:",Ordaining the Future,Curses,M400-M499,Curses,M400-M499
M410,Pronouncement of curses. Icelandic: Herrmann Saxo II 119.,Ordaining the Future,Curses,M400-M499,Curses,M400-M499
M420,Enduring and overcoming curses.,Ordaining the Future,Curses,M400-M499,Curses,M400-M499
M430,Curses on persons. Irish myth: *Cross.,Ordaining the Future,Curses,M400-M499,Curses,M400-M499
M460,"Curses on families. Irish: Plummer clxxiv, *Cross; England, Wales, U.S.:",Ordaining the Future,Curses,M400-M499,Curses,M400-M499
M470,Curses on objects or animals.,Ordaining the Future,Curses,M400-M499,Curses,M400-M499
M490,Curses—miscellaneous.,Ordaining the Future,Curses,M400-M499,Curses,M400-M499
N0,"Wagers and gambling. *Penzer II 232 n., VII 72 n. 2; Paton Encyc. Rel. and",Chance and Fate,Wagers and gambling,N0-N99,Wagers and gambling,N0-N99
N10,"Wagers on wives, husbands, or servants.",Chance and Fate,Wagers and gambling,N0-N99,Wagers and gambling,N0-N99
N50,Other wagers.,Chance and Fate,Wagers and gambling,N0-N99,Wagers and gambling,N0-N99
N90,Wagers and gambling—miscellaneous.,Chance and Fate,Wagers and gambling,N0-N99,Wagers and gambling,N0-N99
N100,Nature of luck and fate. Penzer V 182f.; *Köhler Aufsätze 99ff.; *Patch,Chance and Fate,The ways of luck and fate,N100-N299,NATURE OF LUCK AND FATE,N100-N169
N110,Luck and fate personified.,Chance and Fate,The ways of luck and fate,N100-N299,NATURE OF LUCK AND FATE,N100-N169
N120,Determination of luck or fate.,Chance and Fate,The ways of luck and fate,N100-N299,NATURE OF LUCK AND FATE,N100-N169
N130,Changing of luck or fate.,Chance and Fate,The ways of luck and fate,N100-N299,NATURE OF LUCK AND FATE,N100-N169
N140,Nature of luck and fate—miscellaneous motifs.,Chance and Fate,The ways of luck and fate,N100-N299,NATURE OF LUCK AND FATE,N100-N169
N170,The capriciousness of luck. Icelandic: *Boberg; Jewish: Neuman; India:,Chance and Fate,The ways of luck and fate,N100-N299,The ways of luck and fate.,N100-N299
N200,The good gifts of fortune.,Chance and Fate,The ways of luck and fate,N100-N299,The ways of luck and fate.,N100-N299
N250,"Persistent bad luck. *Fb ""ulykke"" III 973a; Jewish: Neuman; India:",Chance and Fate,The ways of luck and fate,N100-N299,The ways of luck and fate.,N100-N299
N270,"Crime inevitably comes to light. Irish: Beal XXI 336, O'Suilleabhain",Chance and Fate,The ways of luck and fate,N100-N299,The ways of luck and fate.,N100-N299
N300,Unlucky accidents. Norwegian: Solheim Register 21.,Chance and Fate,Unlucky accidents,N300-N399,Unlucky accidents,N300-N399
N310,Accidental separations. Missouri French: Carrière.,Chance and Fate,Unlucky accidents,N300-N399,Unlucky accidents,N300-N399
N320,Person unwittingly killed.,Chance and Fate,Unlucky accidents,N300-N399,Unlucky accidents,N300-N399
N330,Accidental killing or death. Irish myth: Cross.,Chance and Fate,Unlucky accidents,N300-N399,Unlucky accidents,N300-N399
N340,Hasty killing or condemnation (mistake).,Chance and Fate,Unlucky accidents,N300-N399,Unlucky accidents,N300-N399
N350,Accidental loss of property.,Chance and Fate,Unlucky accidents,N300-N399,Unlucky accidents,N300-N399
N360,Man unwittingly commits crime. U.S.: Baughman.,Chance and Fate,Unlucky accidents,N300-N399,Unlucky accidents,N300-N399
N380,Other unlucky accidents.,Chance and Fate,Unlucky accidents,N300-N399,Unlucky accidents,N300-N399
N400,Lucky accident.,Chance and Fate,Lucky accidents,N400-N699,LUCKY ACCIDENTS,N400-N699
N410,Lucky business venture.,Chance and Fate,Lucky accidents,N400-N699,Lucky business ventures,N410-N439
N440,Valuable secrets learned. Missouri French: Carrière.,Chance and Fate,Lucky accidents,N400-N699,Valuable secrets learned,N440-N499
N450,"Secrets overheard. *Chauvin V 13, 293, VIII 61 No. 26; French",Chance and Fate,Lucky accidents,N400-N699,Valuable secrets learned,N440-N499
N500,Treasure trove. **Norlind Skattsägner (bibliography 67f.); **Kittredge,Chance and Fate,Lucky accidents,N400-N699,Treasure trove,N500-N599
N510,Where treasure is found. Chinese: Graham.,Chance and Fate,Lucky accidents,N400-N699,Treasure trove,N500-N599
N530,"Discovery of treasure. *Fb ""skat"" III 235a; India: Thompson-Balys;",Chance and Fate,Lucky accidents,N400-N699,Treasure trove,N500-N599
N550,Unearthing hidden treasure. Irish myth: *Cross; Japanese: Ikeda.,Chance and Fate,Lucky accidents,N400-N699,Treasure trove,N500-N599
N570,"Guardian of treasure. *Fb ""skat"" III 235b, 236a; *Winter 41; *Norlind",Chance and Fate,Lucky accidents,N400-N699,Treasure trove,N500-N599
N590,Treasure trove—miscellaneous motifs.,Chance and Fate,Lucky accidents,N400-N699,Treasure trove,N500-N599
N610,Accidental discovery of crime.,Chance and Fate,Lucky accidents,N400-N699,Other lucky accidents,N600-N699
N620,Accidental success in hunting or fishing.,Chance and Fate,Lucky accidents,N400-N699,Other lucky accidents,N600-N699
N630,Accidental acquisition of treasure or money.,Chance and Fate,Lucky accidents,N400-N699,Other lucky accidents,N600-N699
N640,Accidental healing. India: Thompson-Balys.,Chance and Fate,Lucky accidents,N400-N699,Other lucky accidents,N600-N699
N650,Life saved by accident.,Chance and Fate,Lucky accidents,N400-N699,Other lucky accidents,N600-N699
N660,Accidental escapes. Irish myth: Cross.,Chance and Fate,Lucky accidents,N400-N699,Other lucky accidents,N600-N699
N680,Lucky accidents—miscellaneous.,Chance and Fate,Lucky accidents,N400-N699,Other lucky accidents,N600-N699
N700,Accidental encounters.,Chance and Fate,Accidental encounters,N700-N799,Accidental encounters,N700-N799
N710,Accidental meeting of hero and heroine.,Chance and Fate,Accidental encounters,N700-N799,Accidental encounters,N700-N799
N730,Accidental reunion of families. *Chauvin VI 167ff. No. 327E; Boccaccio,Chance and Fate,Accidental encounters,N700-N799,Accidental encounters,N700-N799
N760,Other accidental encounters.,Chance and Fate,Accidental encounters,N700-N799,Accidental encounters,N700-N799
N770,Experiences leading to adventures.,Chance and Fate,Accidental encounters,N700-N799,Accidental encounters,N700-N799
N800,Helpers.,Chance and Fate,Helpers,N800-N899,Helpers,N800-N899
N810,Supernatural helpers. Irish myth: *Cross; Missouri French: Carrière;,Chance and Fate,Helpers,N800-N899,Helpers,N800-N899
N820,Human helpers.,Chance and Fate,Helpers,N800-N899,Helpers,N800-N899
P0,Royalty and nobility.,Society,Royalty and nobility,P0-P99,Royalty and nobility,P0-P99
P10,Kings. Jewish: *Neuman.,Society,Royalty and nobility,P0-P99,Royalty and nobility,P0-P99
P20,Queens. Irish myth: Cross.,Society,Royalty and nobility,P0-P99,Royalty and nobility,P0-P99
P30,Princes. Irish myth: Cross.,Society,Royalty and nobility,P0-P99,Royalty and nobility,P0-P99
P40,Princesses.,Society,Royalty and nobility,P0-P99,Royalty and nobility,P0-P99
P50,Noblemen (knights).,Society,Royalty and nobility,P0-P99,Royalty and nobility,P0-P99
P60,Noble (gentle) ladies.,Society,Royalty and nobility,P0-P99,Royalty and nobility,P0-P99
P90,Royalty and nobility—miscellaneous.,Society,Royalty and nobility,P0-P99,Royalty and nobility,P0-P99
P110,Royal ministers. Missouri French: Carrière.,Society,Other social orders,P100-P199,Other social orders,P100-P199
P120,Church dignitaries. Irish myth: Cross.,Society,Other social orders,P100-P199,Other social orders,P100-P199
P150,Rich men. Irish myth: Cross; Missouri French: Carrière.,Society,Other social orders,P100-P199,Other social orders,P100-P199
P160,Beggars. Irish myth: Cross; Missouri French: Carrière; Jewish: Neuman.,Society,Other social orders,P100-P199,Other social orders,P100-P199
P170,Slaves. Irish myth: Cross.,Society,Other social orders,P100-P199,Other social orders,P100-P199
P190,Other social orders—miscellaneous. Irish myth: Cross.,Society,Other social orders,P100-P199,Other social orders,P100-P199
P200,The family.,Society,The family,P200-P299,The family,P200-P299
P210,Husband and wife.,Society,The family,P200-P299,The family,P200-P299
P230,"Parents and children. Hdwb. d. Märchens I 527a s.v. ""Eltern und",Society,The family,P200-P299,The family,P200-P299
P250,Brothers and sisters.,Society,The family,P200-P299,The family,P200-P299
P260,Relations by law.,Society,The family,P200-P299,The family,P200-P299
P270,Foster relatives. Irish myth: Cross.,Society,The family,P200-P299,The family,P200-P299
P280,Steprelatives.,Society,The family,P200-P299,The family,P200-P299
P290,Other relatives.,Society,The family,P200-P299,The family,P200-P299
P310,Friendship. *Type 516; *BP I 46; **Rösch FFC LXXVII 96; India:,Society,Other social relationships,P300-P399,Other social relationships,P300-P399
P320,Hospitality. Relation of host and guest. Irish myth: Cross.,Society,Other social relationships,P300-P399,Other social relationships,P300-P399
P340,Teacher and pupil. Irish myth: Cross.,Society,Other social relationships,P300-P399,Other social relationships,P300-P399
P360,Master and servant. **Hdwb. d. Märchens I 389ff.,Society,Other social relationships,P300-P399,Other social relationships,P300-P399
P400,Trades and professions. **Sébillot Légendes et Curiosités des Métiers,Society,Trades and professions,P400-P499,Trades and professions,P400-P499
P410,Laborers.,Society,Trades and professions,P400-P499,Trades and professions,P400-P499
P420,Learned professions.,Society,Trades and professions,P400-P499,Trades and professions,P400-P499
P440,Artisans. Jewish: *Neuman.,Society,Trades and professions,P400-P499,Trades and professions,P400-P499
P460,Other trades and professions.,Society,Trades and professions,P400-P499,Trades and professions,P400-P499
P500,Government.,Society,Government,P500-P599,Government,P500-P599
P510,"Law courts. *E. v. Künssberg Rechtliche Volkskunde (Halle, 1936);",Society,Government,P500-P599,Government,P500-P599
P550,Military affairs. *Hdwb. d. Abergl. IX Nachträge 181—254; Jewish:,Society,Government,P500-P599,Government,P500-P599
P600,Customs.1 Jewish: *Neuman.,Society,Customs,P600-P699,Customs,P600-P699
P710,Nations.,Society,Society—miscellaneous motifs,P700-P799,Society—miscellaneous motifs,P700-P799
P720,Population. Irish myth: Cross.,Society,Society—miscellaneous motifs,P700-P799,Society—miscellaneous motifs,P700-P799
Q0,Rewards and punishments. Irish myth: Cross; Jewish: *Neuman.,Rewards and Punishments,,,,
Q10,Deeds rewarded.,Rewards and Punishments,Deeds rewarded,Q10-Q99,Deeds rewarded,Q10-Q99
Q20,"Piety rewarded. Irish: *Cross, O'Suilleabhain 120, Beal XXI 336; Spanish",Rewards and Punishments,Deeds rewarded,Q10-Q99,Deeds rewarded,Q10-Q99
Q40,Kindness rewarded. *Chauvin VI 109 No. 274 n. 2; Irish: Beal XXI 304;,Rewards and Punishments,Deeds rewarded,Q10-Q99,Deeds rewarded,Q10-Q99
Q60,Other good qualities rewarded.,Rewards and Punishments,Deeds rewarded,Q10-Q99,Deeds rewarded,Q10-Q99
Q80,Rewards for other causes.,Rewards and Punishments,Deeds rewarded,Q10-Q99,Deeds rewarded,Q10-Q99
Q100,Nature of rewards.,Rewards and Punishments,Nature of rewards,Q100-Q199,Nature of rewards,Q100-Q199
Q110,Material rewards.,Rewards and Punishments,Nature of rewards,Q100-Q199,Nature of rewards,Q100-Q199
Q140,Miraculous or magic rewards.,Rewards and Punishments,Nature of rewards,Q100-Q199,Nature of rewards,Q100-Q199
Q150,Immunity from disaster as reward.,Rewards and Punishments,Nature of rewards,Q100-Q199,Nature of rewards,Q100-Q199
Q170,Religious rewards. *Krappe Bulletin Hispanique XXXIX 23; Jewish:,Rewards and Punishments,Nature of rewards,Q100-Q199,Nature of rewards,Q100-Q199
Q190,Rewards—miscellaneous.,Rewards and Punishments,Nature of rewards,Q100-Q199,Nature of rewards,Q100-Q199
Q200,"Deeds punished. **Encyc. Rel. Ethics s.v. ""Crimes and punishments"";",Rewards and Punishments,Deeds punished,Q200-Q399,Deeds punished,Q200-Q399
Q210,Crimes punished. Irish myth: Cross; Norwegian: Solheim Register 21.,Rewards and Punishments,Deeds punished,Q200-Q399,Deeds punished,Q200-Q399
Q220,"Impiety punished. (Cf. Q457.2, Q458.0.5, Q467.2, Q552.2.3.1.2,",Rewards and Punishments,Deeds punished,Q200-Q399,Deeds punished,Q200-Q399
Q240,Sexual sins punished.,Rewards and Punishments,Deeds punished,Q200-Q399,Deeds punished,Q200-Q399
