motif_code,title,level_1_category,level_2_category,level_2_range,level_3_category,level_3_range
J390,"Choices: kind strangers, unkind relatives.",The Wise and the Foolish,WISE AND UNWISE CONDUCT,J200-J1099,Gains and losses,J330-J399
J400,Choice of associates.,The Wise and the Foolish,WISE AND UNWISE CONDUCT,J200-J1099,CHOICE OF ASSOCIATES,J400-J459
J410,Association of equals and unequals.,The Wise and the Foolish,WISE AND UNWISE CONDUCT,J200-J1099,CHOICE OF ASSOCIATES,J400-J459
J420,Association of strong and weak.,The Wise and the Foolish,WISE AND UNWISE CONDUCT,J200-J1099,CHOICE OF ASSOCIATES,J400-J459
J440,Association of young and old.,The Wise and the Foolish,WISE AND UNWISE CONDUCT,J200-J1099,CHOICE OF ASSOCIATES,J400-J459
J450,Association of the good and the evil.,The Wise and the Foolish,WISE AND UNWISE CONDUCT,J200-J1099,CHOICE OF ASSOCIATES,J400-J459
J460,Unnecessary choices.,The Wise and the Foolish,WISE AND UNWISE CONDUCT,J200-J1099,Choices,J200-J499
J480,Other choices.,The Wise and the Foolish,WISE AND UNWISE CONDUCT,J200-J1099,Choices,J200-J499
J510,Prudence in ambition.,The Wise and the Foolish,WISE AND UNWISE CONDUCT,J200-J1099,Prudence and discretion,J500-J599
J530,Prudence in demands.,The Wise and the Foolish,WISE AND UNWISE CONDUCT,J200-J1099,Prudence and discretion,J500-J599
J550,Zeal—temperate and intemperate.,The Wise and the Foolish,WISE AND UNWISE CONDUCT,J200-J1099,Prudence and discretion,J500-J599
J570,Wisdom of deliberation.,The Wise and the Foolish,WISE AND UNWISE CONDUCT,J200-J1099,Prudence and discretion,J500-J599
J580,Wisdom of caution.,The Wise and the Foolish,WISE AND UNWISE CONDUCT,J200-J1099,Prudence and discretion,J500-J599
J610,Forethought in conflict with others—general.,The Wise and the Foolish,WISE AND UNWISE CONDUCT,J200-J1099,FORETHOUGHT IN CONFLICTS WITH OTHERS,J610-J679
J620,Forethought in prevention of others's plans. Icelandic: *Boberg.,The Wise and the Foolish,WISE AND UNWISE CONDUCT,J200-J1099,FORETHOUGHT IN CONFLICTS WITH OTHERS,J610-J679
J640,Avoidance of others' power.,The Wise and the Foolish,WISE AND UNWISE CONDUCT,J200-J1099,FORETHOUGHT IN CONFLICTS WITH OTHERS,J610-J679
J670,Forethought in defences against others.,The Wise and the Foolish,WISE AND UNWISE CONDUCT,J200-J1099,FORETHOUGHT IN CONFLICTS WITH OTHERS,J610-J679
J680,Forethought in alliances. Spanish Exempla: Keller.,The Wise and the Foolish,WISE AND UNWISE CONDUCT,J200-J1099,Forethought,J600-J799
J700,Forethought in provision for life (general).,The Wise and the Foolish,WISE AND UNWISE CONDUCT,J200-J1099,FORETHOUGHT IN PROVISION FOR LIFE,J700-J749
J710,Forethought in provision for food.,The Wise and the Foolish,WISE AND UNWISE CONDUCT,J200-J1099,FORETHOUGHT IN PROVISION FOR LIFE,J700-J749
J740,Forethought in provision for shelter.,The Wise and the Foolish,WISE AND UNWISE CONDUCT,J200-J1099,FORETHOUGHT IN PROVISION FOR LIFE,J700-J749
J810,Policy in dealing with the great.,The Wise and the Foolish,WISE AND UNWISE CONDUCT,J200-J1099,Adaptability,J800-J849
J830,Adaptability to overpowering force.,The Wise and the Foolish,WISE AND UNWISE CONDUCT,J200-J1099,Adaptability,J800-J849
J860,Consolation by a trifle.,The Wise and the Foolish,WISE AND UNWISE CONDUCT,J200-J1099,CONSOLATION IN MISFORTUNE,J850-J899
J870,Consolation by pretending that one does not want the thing he cannot,The Wise and the Foolish,WISE AND UNWISE CONDUCT,J200-J1099,CONSOLATION IN MISFORTUNE,J850-J899
J880,Consolation by thought of others worse placed.,The Wise and the Foolish,WISE AND UNWISE CONDUCT,J200-J1099,CONSOLATION IN MISFORTUNE,J850-J899
J890,Consolation in misfortune—miscellaneous.,The Wise and the Foolish,WISE AND UNWISE CONDUCT,J200-J1099,CONSOLATION IN MISFORTUNE,J850-J899
J900,Humility.,The Wise and the Foolish,WISE AND UNWISE CONDUCT,J200-J1099,Humility,J900-J999
J910,Humility of the great.,The Wise and the Foolish,WISE AND UNWISE CONDUCT,J200-J1099,Humility,J900-J999
J950,Presumption of the lowly.,The Wise and the Foolish,WISE AND UNWISE CONDUCT,J200-J1099,Humility,J900-J999
J1010,Value of industry.,The Wise and the Foolish,WISE AND UNWISE CONDUCT,J200-J1099,Other aspects of wisdom.,J1000-J1099
J1020,Strength in unity.,The Wise and the Foolish,WISE AND UNWISE CONDUCT,J200-J1099,Other aspects of wisdom.,J1000-J1099
J1030,Self-dependence.,The Wise and the Foolish,WISE AND UNWISE CONDUCT,J200-J1099,Other aspects of wisdom.,J1000-J1099
J1040,Decisiveness of conduct.,The Wise and the Foolish,WISE AND UNWISE CONDUCT,J200-J1099,Other aspects of wisdom.,J1000-J1099
J1050,Attention to warnings.,The Wise and the Foolish,WISE AND UNWISE CONDUCT,J200-J1099,Other aspects of wisdom.,J1000-J1099
J1060,Miscellaneous aspects of wisdom.,The Wise and the Foolish,WISE AND UNWISE CONDUCT,J200-J1099,Other aspects of wisdom.,J1000-J1099
J1100,Cleverness.,The Wise and the Foolish,CLEVERNESS,J1100-J1699,Clever persons and acts.,J1100-J1249
J1110,Clever persons. Irish myth: *Cross; Missouri French: Carrière.,The Wise and the Foolish,CLEVERNESS,J1100-J1699,Clever persons and acts.,J1100-J1249
J1130,Cleverness in law court—general. Jewish: *Neuman.,The Wise and the Foolish,CLEVERNESS,J1100-J1699,CLEVERNESS IN THE LAW COURT,J1130-J1199
J1140,Cleverness in detection of truth.,The Wise and the Foolish,CLEVERNESS,J1100-J1699,CLEVERNESS IN THE LAW COURT,J1130-J1199
J1150,Cleverness connected with the giving of evidence.,The Wise and the Foolish,CLEVERNESS,J1100-J1699,CLEVERNESS IN THE LAW COURT,J1130-J1199
J1160,Clever pleading.,The Wise and the Foolish,CLEVERNESS,J1100-J1699,CLEVERNESS IN THE LAW COURT,J1130-J1199
J1180,Clever means of avoiding legal punishment.,The Wise and the Foolish,CLEVERNESS,J1100-J1699,CLEVERNESS IN THE LAW COURT,J1130-J1199
J1190,Cleverness in the lawcourt—miscellaneous.,The Wise and the Foolish,CLEVERNESS,J1100-J1699,CLEVERNESS IN THE LAW COURT,J1130-J1199
J1210,Clever man puts another out of countenance.,The Wise and the Foolish,CLEVERNESS,J1100-J1699,CLEVER MAN PUTS ANOTHER OUT OF COUNTENANCE,J1210-J1229
J1250,Clever verbal retorts—general. Boccaccio Decameron Day 6 (Lee,The Wise and the Foolish,CLEVERNESS,J1100-J1699,Clever verbal retorts (repartee).,J1250-J1499
J1260,Repartee based on church or clergy.,The Wise and the Foolish,CLEVERNESS,J1100-J1699,Clever verbal retorts (repartee).,J1250-J1499
J1270,Repartee concerning the parentage of children.,The Wise and the Foolish,CLEVERNESS,J1100-J1699,Clever verbal retorts (repartee).,J1250-J1499
J1280,"Repartee with ruler (judge, etc.).",The Wise and the Foolish,CLEVERNESS,J1100-J1699,Clever verbal retorts (repartee).,J1250-J1499
J1290,Reductio ad absurdum of question or proposal.,The Wise and the Foolish,CLEVERNESS,J1100-J1699,Clever verbal retorts (repartee).,J1250-J1499
J1300,Officiousness or foolish questions rebuked. Irish myth: Cross.,The Wise and the Foolish,CLEVERNESS,J1100-J1699,Clever verbal retorts (repartee).,J1250-J1499
J1310,Repartee concerning wine.,The Wise and the Foolish,CLEVERNESS,J1100-J1699,Clever verbal retorts (repartee).,J1250-J1499
J1320,Repartee concerning drunkenness.,The Wise and the Foolish,CLEVERNESS,J1100-J1699,Clever verbal retorts (repartee).,J1250-J1499
J1330,Repartee concerning beggars.,The Wise and the Foolish,CLEVERNESS,J1100-J1699,Clever verbal retorts (repartee).,J1250-J1499
J1340,Retorts from hungry persons. Irish myth: Cross; U.S.: Baughman.,The Wise and the Foolish,CLEVERNESS,J1100-J1699,Clever verbal retorts (repartee).,J1250-J1499
J1350,Rude retorts. Irish myth: *Cross.,The Wise and the Foolish,CLEVERNESS,J1100-J1699,Clever verbal retorts (repartee).,J1250-J1499
J1370,Cynical retorts concerning honesty.,The Wise and the Foolish,CLEVERNESS,J1100-J1699,Clever verbal retorts (repartee).,J1250-J1499
J1380,Retorts concerning debts.,The Wise and the Foolish,CLEVERNESS,J1100-J1699,Clever verbal retorts (repartee).,J1250-J1499
J1390,Retorts concerning thefts.,The Wise and the Foolish,CLEVERNESS,J1100-J1699,Clever verbal retorts (repartee).,J1250-J1499
J1400,Repartee concerning false reform.,The Wise and the Foolish,CLEVERNESS,J1100-J1699,Clever verbal retorts (repartee).,J1250-J1499
J1410,Repartee concerning fatness.,The Wise and the Foolish,CLEVERNESS,J1100-J1699,Clever verbal retorts (repartee).,J1250-J1499
J1420,Animals retort concerning their dangers.,The Wise and the Foolish,CLEVERNESS,J1100-J1699,Clever verbal retorts (repartee).,J1250-J1499
J1430,Repartee concerning doctors and patients.,The Wise and the Foolish,CLEVERNESS,J1100-J1699,Clever verbal retorts (repartee).,J1250-J1499
J1440,Repartee—miscellaneous.,The Wise and the Foolish,CLEVERNESS,J1100-J1699,Clever verbal retorts (repartee).,J1250-J1499
J1500,Clever practical retort.,The Wise and the Foolish,CLEVERNESS,J1100-J1699,Clever practical retorts,J1500-J1649
J1510,The cheater cheated.,The Wise and the Foolish,CLEVERNESS,J1100-J1699,Clever practical retorts,J1500-J1649
J1530,"One absurdity rebukes another. Brown JAOS XXIX 43 n. 40, Penzer",The Wise and the Foolish,CLEVERNESS,J1100-J1699,Clever practical retorts,J1500-J1649
J1540,Retorts between husband and wife. (Cf. J1532.1.) Irish myth: *Cross.,The Wise and the Foolish,CLEVERNESS,J1100-J1699,Clever practical retorts,J1500-J1649
J1550,Practical retorts: borrowers and lenders.,The Wise and the Foolish,CLEVERNESS,J1100-J1699,Clever practical retorts,J1500-J1649
J1560,Practical retorts: hosts and guests.,The Wise and the Foolish,CLEVERNESS,J1100-J1699,Clever practical retorts,J1500-J1649
J1580,Practical retorts connected with almsgiving.,The Wise and the Foolish,CLEVERNESS,J1100-J1699,Clever practical retorts,J1500-J1649
J1600,Practical retorts—miscellaneous.,The Wise and the Foolish,CLEVERNESS,J1100-J1699,Clever practical retorts,J1500-J1649
J1700,Fools. **Clouston Noodles; *Field Myth of the Pent Cuckoo; *Types,The Wise and the Foolish,FOOLS (AND OTHER UNWISE PERSONS),J1700-J2749,Fools (general),J1700-J1729
J1710,Association with fools.,The Wise and the Foolish,FOOLS (AND OTHER UNWISE PERSONS),J1700-J2749,Association with fools,J1710-J1729
J1730,Absurd ignorance.,The Wise and the Foolish,FOOLS (AND OTHER UNWISE PERSONS),J1700-J2749,Absurd ignorance,J1730-J1749
J1750,One animal mistaken for another.,The Wise and the Foolish,FOOLS (AND OTHER UNWISE PERSONS),J1700-J2749,ONE THING MISTAKEN FOR ANOTHER,J1750-J1809
J1760,Animal or person mistaken for something else.,The Wise and the Foolish,FOOLS (AND OTHER UNWISE PERSONS),J1700-J2749,ONE THING MISTAKEN FOR ANOTHER,J1750-J1809
J1770,"Objects with mistaken identity. England, U.S.: *Baughman.",The Wise and the Foolish,FOOLS (AND OTHER UNWISE PERSONS),J1700-J2749,ONE THING MISTAKEN FOR ANOTHER,J1750-J1809
J1780,"Things thought to be devils, ghosts, etc. Indonesian: Coster-Wijsman",The Wise and the Foolish,FOOLS (AND OTHER UNWISE PERSONS),J1700-J2749,ONE THING MISTAKEN FOR ANOTHER,J1750-J1809
J1790,Shadow mistaken for substance. India: Thompson-Balys.,The Wise and the Foolish,FOOLS (AND OTHER UNWISE PERSONS),J1700-J2749,ONE THING MISTAKEN FOR ANOTHER,J1750-J1809
J1800,One thing mistaken for another—miscellaneous.,The Wise and the Foolish,FOOLS (AND OTHER UNWISE PERSONS),J1700-J2749,ONE THING MISTAKEN FOR ANOTHER,J1750-J1809
J1810,Physical phenomena misunderstood.,The Wise and the Foolish,FOOLS (AND OTHER UNWISE PERSONS),J1700-J2749,Absurd misunderstandings,J1750-J1849
J1820,Inappropriate action from misunderstanding.,The Wise and the Foolish,FOOLS (AND OTHER UNWISE PERSONS),J1700-J2749,Absurd misunderstandings,J1750-J1849
J1850,Gift or sale to animal (or object).,The Wise and the Foolish,FOOLS (AND OTHER UNWISE PERSONS),J1700-J2749,ANIMALS OR OBJECTS TREATED AS IF HUMAN,J1850-J1899
J1860,Animal or object absurdly punished.,The Wise and the Foolish,FOOLS (AND OTHER UNWISE PERSONS),J1700-J2749,ANIMALS OR OBJECTS TREATED AS IF HUMAN,J1850-J1899
J1870,Absurd sympathy for animals or objects.,The Wise and the Foolish,FOOLS (AND OTHER UNWISE PERSONS),J1700-J2749,ANIMALS OR OBJECTS TREATED AS IF HUMAN,J1850-J1899
J1880,Animals or objects treated as if human—miscellaneous.,The Wise and the Foolish,FOOLS (AND OTHER UNWISE PERSONS),J1700-J2749,ANIMALS OR OBJECTS TREATED AS IF HUMAN,J1850-J1899
J1900,Absurd disregard or ignorance of animal's nature or habits.,The Wise and the Foolish,FOOLS (AND OTHER UNWISE PERSONS),J1700-J2749,Absurd disregard of facts.,J1850-J1999
J1910,Fatal disregard of anatomy.,The Wise and the Foolish,FOOLS (AND OTHER UNWISE PERSONS),J1700-J2749,Absurd disregard of facts.,J1850-J1999
J1920,Absurd searches for the lost.,The Wise and the Foolish,FOOLS (AND OTHER UNWISE PERSONS),J1700-J2749,Absurd disregard of facts.,J1850-J1999
J1930,Absurd disregard of natural laws.,The Wise and the Foolish,FOOLS (AND OTHER UNWISE PERSONS),J1700-J2749,Absurd disregard of facts.,J1850-J1999
J1960,Other absurd disregard of facts.,The Wise and the Foolish,FOOLS (AND OTHER UNWISE PERSONS),J1700-J2749,Absurd disregard of facts.,J1850-J1999
J2010,Uncertainty about own identity.,The Wise and the Foolish,FOOLS (AND OTHER UNWISE PERSONS),J1700-J2749,ABSURD ABSENT-MINDEDNESS,J2000-J2049
J2020,"Inability to find own members, etc.",The Wise and the Foolish,FOOLS (AND OTHER UNWISE PERSONS),J1700-J2749,ABSURD ABSENT-MINDEDNESS,J2000-J2049
J2030,Absurd inability to count. Christensen DF XLVII 181ff.; India:,The Wise and the Foolish,FOOLS (AND OTHER UNWISE PERSONS),J1700-J2749,ABSURD ABSENT-MINDEDNESS,J2000-J2049
J2040,Absurd absent-mindedness—miscellaneous. U.S.: Baughman.,The Wise and the Foolish,FOOLS (AND OTHER UNWISE PERSONS),J1700-J2749,ABSURD ABSENT-MINDEDNESS,J2000-J2049
J2050,Absurd short-sightedness. *Wienert FFC LVI 108 (15*).,The Wise and the Foolish,FOOLS (AND OTHER UNWISE PERSONS),J1700-J2749,Absurd absent-mindedness,J2000-J2050
J2060,Absurd plans. Air-castles. *Type 1430; *Wesselski Hodscha Nasreddin,The Wise and the Foolish,FOOLS (AND OTHER UNWISE PERSONS),J1700-J2749,ABSURD SHORT-SIGHTEDNESS,J2050-J2199
J2070,Absurd wishes.,The Wise and the Foolish,FOOLS (AND OTHER UNWISE PERSONS),J1700-J2749,ABSURD SHORT-SIGHTEDNESS,J2050-J2199
J2080,Foolish bargains. Missouri French: Carrière; India: *Thompson-Balys.,The Wise and the Foolish,FOOLS (AND OTHER UNWISE PERSONS),J1700-J2749,ABSURD SHORT-SIGHTEDNESS,J2050-J2199
J2100,Remedies worse than the disease.,The Wise and the Foolish,FOOLS (AND OTHER UNWISE PERSONS),J1700-J2749,ABSURD SHORT-SIGHTEDNESS,J2050-J2199
J2120,Disregard of danger to objects (or animals).,The Wise and the Foolish,FOOLS (AND OTHER UNWISE PERSONS),J1700-J2749,ABSURD SHORT-SIGHTEDNESS,J2050-J2199
J2130,Foolish disregard of personal danger.,The Wise and the Foolish,FOOLS (AND OTHER UNWISE PERSONS),J1700-J2749,ABSURD SHORT-SIGHTEDNESS,J2050-J2199
J2160,Other short-sighted acts.,The Wise and the Foolish,FOOLS (AND OTHER UNWISE PERSONS),J1700-J2749,ABSURD SHORT-SIGHTEDNESS,J2050-J2199
J2200,Absurd lack of logic—general. Missouri French: Carrière.,The Wise and the Foolish,FOOLS (AND OTHER UNWISE PERSONS),J1700-J2749,Absurd lack of logic.,J2200-J2259
J2210,Logical absurdity based upon certain false assumptions.,The Wise and the Foolish,FOOLS (AND OTHER UNWISE PERSONS),J1700-J2749,Absurd lack of logic.,J2200-J2259
J2220,Other logical absurdities.,The Wise and the Foolish,FOOLS (AND OTHER UNWISE PERSONS),J1700-J2749,Absurd lack of logic.,J2200-J2259
J2260,Absurd scientific theories—general.,The Wise and the Foolish,FOOLS (AND OTHER UNWISE PERSONS),J1700-J2749,Absurd scientific theories,J2260-J2299
J2270,Absurd astronomical theories.,The Wise and the Foolish,FOOLS (AND OTHER UNWISE PERSONS),J1700-J2749,Absurd scientific theories,J2260-J2299
J2280,Other absurd scientific theories. Irish myth: *Cross.,The Wise and the Foolish,FOOLS (AND OTHER UNWISE PERSONS),J1700-J2749,Absurd scientific theories,J2260-J2299
J2300,Gullible fools.,The Wise and the Foolish,FOOLS (AND OTHER UNWISE PERSONS),J1700-J2749,Gullible fools,J2300-J2349
J2310,Nature of gullibility.,The Wise and the Foolish,FOOLS (AND OTHER UNWISE PERSONS),J1700-J2749,Gullible fools,J2300-J2349
J2370,Inquisitive fool.,The Wise and the Foolish,FOOLS (AND OTHER UNWISE PERSONS),J1700-J2749,Inquisitive fools,J2370-J2399
J2400,Foolish imitation.,The Wise and the Foolish,FOOLS (AND OTHER UNWISE PERSONS),J1700-J2749,Foolish imitation,J2400-J2449
J2410,Types of foolish imitation.,The Wise and the Foolish,FOOLS (AND OTHER UNWISE PERSONS),J1700-J2749,Foolish imitation,J2400-J2449
J2420,Foolish imitation—miscellaneous.,The Wise and the Foolish,FOOLS (AND OTHER UNWISE PERSONS),J1700-J2749,Foolish imitation,J2400-J2449
J2450,Literal fool.,The Wise and the Foolish,FOOLS (AND OTHER UNWISE PERSONS),J1700-J2749,Literal fools,J2450-J2499
J2460,Literal obedience. Gaster Oldest Stories 167; India: *Thompson-Balys;,The Wise and the Foolish,FOOLS (AND OTHER UNWISE PERSONS),J1700-J2749,Literal fools,J2450-J2499
J2470,Metaphors literally interpreted. India: *Thompson-Balys; N. A. Indian,The Wise and the Foolish,FOOLS (AND OTHER UNWISE PERSONS),J1700-J2749,Literal fools,J2450-J2499
J2490,Literal fool—miscellaneous.,The Wise and the Foolish,FOOLS (AND OTHER UNWISE PERSONS),J1700-J2749,Literal fools,J2450-J2499
J2600,Cowardly fool. *BP II 555.,The Wise and the Foolish,FOOLS (AND OTHER UNWISE PERSONS),J1700-J2749,Cowardly fool,J2600-J2649
J2650,Bungling fool. Type 1690*; India: *Thompson-Balys.,The Wise and the Foolish,FOOLS (AND OTHER UNWISE PERSONS),J1700-J2749,Bungling fool,J2650-J2699
J2700,The easy problem made hard.,The Wise and the Foolish,FOOLS (AND OTHER UNWISE PERSONS),J1700-J2749,The easy problem made hard.,J2700-J2749
K0,Contest won by deception—general. Irish myth: *Cross.,Deceptions,Contests won by deception,K0-K99,Contests won by deception.,K0-K99
K10,Athletic contest won by deception.,Deceptions,Contests won by deception,K0-K99,Contests won by deception.,K0-K99
K30,Hunting contest won by deception.,Deceptions,Contests won by deception,K0-K99,Contests won by deception.,K0-K99
K40,Labor contest won by deception.,Deceptions,Contests won by deception,K0-K99,Contests won by deception.,K0-K99
K50,Endurance contest won by deception.,Deceptions,Contests won by deception,K0-K99,Contests won by deception.,K0-K99
K60,Absurd contest won by deception.,Deceptions,Contests won by deception,K0-K99,Contests won by deception.,K0-K99
K70,Contest in strength won by deception.,Deceptions,Contests won by deception,K0-K99,Contests won by deception.,K0-K99
K80,Contests in other physical accomplishments won by deception.,Deceptions,Contests won by deception,K0-K99,Contests won by deception.,K0-K99
K90,Other contests won by deception.,Deceptions,Contests won by deception,K0-K99,Contests won by deception.,K0-K99
K100,Deceptive bargains. Icelandic: Boberg.,Deceptions,Deceptive bargains,K100-K299,Deceptive bargains,K100-K299
K110,Sale of pseudo-magic objects. French Canadian: Barbeau JAFL XXIX,Deceptions,Deceptive bargains,K100-K299,SALE OF WORTHLESS ARTICLES,K110-K149
K120,Sale of false treasure.,Deceptions,Deceptive bargains,K100-K299,SALE OF WORTHLESS ARTICLES,K110-K149
K130,Sale of worthless animals.,Deceptions,Deceptive bargains,K100-K299,SALE OF WORTHLESS ARTICLES,K110-K149
K140,Sale of other worthless objects.,Deceptions,Deceptive bargains,K100-K299,SALE OF WORTHLESS ARTICLES,K110-K149
K150,Sale of worthless services.,Deceptions,Deceptive bargains,K100-K299,Deceptive bargains,K100-K299
K170,Deception through pseudo-simple bargain.,Deceptions,Deceptive bargains,K100-K299,Deceptive bargains,K100-K299
K200,Deception in payment of debt.,Deceptions,Deceptive bargains,K100-K299,DECEPTION IN PAYMENT OF DEBT,K200-K249
K210,Devil cheated of his promised soul. The man saves it through deceit.,Deceptions,Deceptive bargains,K100-K299,DECEPTION IN PAYMENT OF DEBT,K200-K249
K220,Payment precluded by terms of the bargain. India: Thompson-Balys.,Deceptions,Deceptive bargains,K100-K299,DECEPTION IN PAYMENT OF DEBT,K200-K249
K230,Other deceptions in the payment of debt.,Deceptions,Deceptive bargains,K100-K299,DECEPTION IN PAYMENT OF DEBT,K200-K249
K250,Other deceptive bargains.,Deceptions,Deceptive bargains,K100-K299,Deceptive bargains,K100-K299
K300,Thefts and cheats—general. *Bloomfield Am. J. of Philology XLIV,Deceptions,Thefts and cheats,K300-K499,Thefts and cheats,K300-K499
K310,Means of entering house or treasury.,Deceptions,Thefts and cheats,K300-K499,THEFTS,K310-K439
K330,Means of hoodwinking the guardian or owner.,Deceptions,Thefts and cheats,K300-K499,THEFTS,K310-K439
K360,Other means of theft.,Deceptions,Thefts and cheats,K300-K499,THEFTS,K310-K439
K400,Thief escapes detection.,Deceptions,Thefts and cheats,K300-K499,THEFTS,K310-K439
K420,Thief loses his goods or is detected.,Deceptions,Thefts and cheats,K300-K499,THEFTS,K310-K439
K440,Other cheats.,Deceptions,Thefts and cheats,K300-K499,Other cheats,K440-K499
K500,Escape from death or danger by deception. *Chauvin VIII 136 No.,Deceptions,Escape by deception,K500-K699,Escape by deception,K500-K699
K510,Death order evaded. India: Thompson-Balys.,Deceptions,Escape by deception,K500-K699,Escape by deception,K500-K699
K520,"Death escaped through disguise, shamming, or substitution.",Deceptions,Escape by deception,K500-K699,Escape by deception,K500-K699
K540,Escape by overawing captor.,Deceptions,Escape by deception,K500-K699,Escape by deception,K500-K699
K550,Escape by false plea. A captive makes a request or proposes an action,Deceptions,Escape by deception,K500-K699,Escape by deception,K500-K699
K580,Captor persuaded into illusory punishment.,Deceptions,Escape by deception,K500-K699,Escape by deception,K500-K699
K600,Murderer or captor otherwise beguiled.,Deceptions,Escape by deception,K500-K699,Escape by deception,K500-K699
K620,Escape by deceiving the guard. India: Thompson-Balys.,Deceptions,Escape by deception,K500-K699,Escape by deception,K500-K699
K630,Escape by disarming (making pursuit difficult). Irish myth: *Cross.,Deceptions,Escape by deception,K500-K699,Escape by deception,K500-K699
K640,Escape by help of confederate.,Deceptions,Escape by deception,K500-K699,Escape by deception,K500-K699
K650,Other means of escape.,Deceptions,Escape by deception,K500-K699,Escape by deception,K500-K699
K700,Capture by deception.,Deceptions,Capture by deception,K700-K799,Capture by deception,K700-K799
K710,Victim enticed into voluntary captivity or helplessness.,Deceptions,Capture by deception,K700-K799,Capture by deception,K700-K799
K730,Victim trapped. India: Thompson-Balys; Indonesia: DeVries's list No. 47.,Deceptions,Capture by deception,K700-K799,Capture by deception,K700-K799
K750,Capture by decoy. Irish myth: Cross.,Deceptions,Capture by deception,K700-K799,Capture by deception,K700-K799
K770,Other deceptive captures.,Deceptions,Capture by deception,K700-K799,Capture by deception,K700-K799
K800,Killing or maiming by deception. India: Thompson-Balys.,Deceptions,Fatal deception,K800-K999,Killing or maiming by deception.,K800-K999
K810,Fatal deception into trickster's power.,Deceptions,Fatal deception,K800-K999,Killing or maiming by deception.,K800-K999
K840,Deception into fatal substitution.,Deceptions,Fatal deception,K800-K999,Killing or maiming by deception.,K800-K999
K850,Fatal deceptive game.,Deceptions,Fatal deception,K800-K999,Killing or maiming by deception.,K800-K999
K870,Fatal deception by narcotic (intoxication).,Deceptions,Fatal deception,K800-K999,Killing or maiming by deception.,K800-K999
K890,Dupe tricked into killing himself. Missouri French: Carrière.,Deceptions,Fatal deception,K800-K999,Killing or maiming by deception.,K800-K999
K910,"Murder by strategy. Types 10**, 221, 228; Irish myth: *Cross; Icelandic:",Deceptions,Fatal deception,K800-K999,Killing or maiming by deception.,K800-K999
K930,Treacherous murder of enemy's children or charges. Icelandic:,Deceptions,Fatal deception,K800-K999,Killing or maiming by deception.,K800-K999
K940,Deception into killing own family or animals.,Deceptions,Fatal deception,K800-K999,Killing or maiming by deception.,K800-K999
K950,Various kinds of treacherous murder. *Type 709; *Böklen 100ff.,Deceptions,Fatal deception,K800-K999,Killing or maiming by deception.,K800-K999
K960,Other fatal deceits.,Deceptions,Fatal deception,K800-K999,Killing or maiming by deception.,K800-K999
K1000,Deception into self-injury. Japanese: Ikeda; Indonesia: DeVries's list,Deceptions,Deception into self-injury,K1000-K1199,Deception into self-injury,K1000-K1199
K1010,Deception through false doctoring. Type 1136; Chinese: Graham.,Deceptions,Deception into self-injury,K1000-K1199,Deception into self-injury,K1000-K1199
K1020,Deception into disastrous attempt to procure food.,Deceptions,Deception into self-injury,K1000-K1199,Deception into self-injury,K1000-K1199
K1040,Dupe otherwise persuaded to voluntary self-injury.,Deceptions,Deception into self-injury,K1000-K1199,Deception into self-injury,K1000-K1199
K1080,Persons duped into injuring each other. Icelandic: Boberg.,Deceptions,Deception into self-injury,K1000-K1199,Deception into self-injury,K1000-K1199
K1110,Deceptions into self injury-miscellaneous.,Deceptions,Deception into self-injury,K1000-K1199,Deception into self-injury,K1000-K1199
K1200,Deception into humiliating position.,Deceptions,Deception into humiliating position,K1200-K1299,Deception into humiliating position.,K1200-K1299
K1210,Humiliated or baffled lovers. Child II 480—93 No. 112; Braga,Deceptions,Deception into humiliating position,K1200-K1299,Deception into humiliating position.,K1200-K1299
K1240,Deception into humiliating position—miscellaneous.,Deceptions,Deception into humiliating position,K1200-K1299,Deception into humiliating position.,K1200-K1299
K1300,Seduction.,Deceptions,Seduction or deceptive marriage,K1300-K1399,Seduction or deceptive marriage.,K1300-K1399
